"CD_AnnotatedMembers_Overlap","CD_AnnotatedMembers_Pvalue","CD_AnnotatedMembers_Size","CD_CommunityName","CD_Labeled","CD_MemberList","CD_MemberList_LogSize","CD_MemberList_Size","name","selected"
"0.0","0.0","0","false","ABCA12 ABCA2 ABCA3 ABCA4 ABCA5 ABCB10 ABCB11 ABCB6 ABCB7 ABCB8 ABCC6 ABCD1 ABCG1 ABCG4 ABHD4 ABHD5 ABHD8 ACACB ACADL ACADVL ACE ACER1 ACIN1 ACOX2 ACOX3 ACOXL ACP5 ACSM1 ACSM2A ACSM3 ACTG1 ADA ADAR ADCY6 ADCY8 ADGRF5 ADGRG1 ADGRV1 ADIPOR1 ADIPOR2 ADM ADNP ADORA1 ADRA2A ADRB1 ADRB2 ADRB3 AFG3L2 AGER AHSP AIPL1 AKAP11 AKR1B1 AKR1C1 ALAS1 ALAS2 ALDH1A1 ALDOA ALOX12 ALOX12B ALOX5 ALOXE3 ALPL AMPD2 ANG ANGPTL3 ANGPTL4 ANGPTL8 ANK3 ANKH ANKRD9 ANO6 ANXA1 ANXA6 AP3B1 AP3D1 APBB2 APEX1 APOC4 APOM APP APPL2 AQP1 AQP11 AQP2 AQP3 AQP6 ARF1 ARHGEF5 ARID2 ARID4A ARMCX1 ARMS2 ARRDC3 ASPH ASPSCR1 ASXL1 ATF4 ATOX1 ATP13A1 ATP13A2 ATP13A3 ATP1A2 ATP1B1 ATP1B2 ATP1B3 ATP2A1 ATP2A2 ATP2A3 ATP2B1 ATP2B2 ATP2B3 ATP2B4 ATP2C1 ATP2C2 ATP4B ATP5F1B ATP5IF1 ATP6AP1L ATP6AP2 ATP6V0A1 ATP6V1F ATP6V1G1 ATP7A ATP7B AVP AVPR1A AVPR1B AXL AZGP1 B2M BACE2 BAD BAG3 BAK1 BAP1 BARD1 BAX BBC3 BBS1 BBS10 BBS12 BBS2 BBS4 BCAP31 BCL6 BCR BDH2 BECN2 BHLHA15 BMP4 BMP6 BMP8A BNIP3 BOK BOLA1 BOLA2 BOLA2B BOLA3 BPGM BPIFA1 BRD1 BSG BTBD9 C15orf41 C19orf12 C1QTNF3 CA12 CA2 CA7 CALB1 CALB2 CALCA CALCB CAMK2D CAMLG CAPN3 CARD11 CARD9 CARTPT CASQ2 CASR CAV1 CAV2 CAV3 CCDC115 CCDC186 CCDC22 CCDC47 CCDC51 CCKBR CCL1 CCL11 CCL13 CCL14 CCL15 CCL23 CCL7 CCL8 CCN3 CCN4 CCNB2 CCR1 CCR4 CD34 CDH2 CDH23 CDH3 CDH5 CDHR1 CDK5RAP3 CEBPG CERT1 CES1 CFL2 CFTR CHERP CHMP2B CHMP4B CHP1 CHRNA1 CHRNA7 CIAO3 CIB2 CIB3 CIDEA CITED2 CKB CLCN3 CLCN6 CLDN1 CLDN12 CLDN16 CLDN3 CLDN4 CLDN5 CLIC4 CLN3 CLN5 CLN6 CLN8 CLNS1A CLRN1 CLTRN CMA1 CNBP CNGB1 CNNM1 CNNM2 CNNM3 CNNM4 CNR1 COL11A2 COL2A1 COL3A1 COMMD1 COMMD9 COMP CORO1A COX11 COX19 CPB2 CPS1 CRB1 CRB2 CROCC CRTC1 CRTC2 CRTC3 CRY1 CRY2 CSMD1 CSRP3 CST4 CTRC CTSH CUBN CUTC CXADR CXCL6 CXorf21 CYB561 CYB561A3 CYB561D2 CYB5R4 CYBA CYBRD1 CYP11B1 CYP11B2 CYP26B1 CYP27B1 CYP39A1 CYP4A11 CYP4F12 CYP4F2 CYP7B1 CYTL1 DBH DCTN1 DDB1 DDIT3 DDX3X DEDD2 DGAT1 DGAT2 DHPS DHRS7C DISC1 DISP3 DLD DLL1 DMD DMPK DMTN DMXL1 DMXL2 DNAJA3 DNAJB2 DNASE2 DOCK10 DOCK11 DRAM2 DRD1 DRD2 DRD3 DRD4 DRD5 DYNLT1 DYRK3 E2F4 EDN2 EDN3 EDNRA EDNRB EGLN1 EGLN2 EGR1 EHD1 EIF2AK1 EIF4G1 EIF5A2 ELANE ELOVL1 EMCN EMX1 ENDOG ENPP1 ENPP3 ENPP7 ENSP00000493780 ENSP00000498010 EPB42 EPHX2 ERCC2 ERCC6 ERFE ERO1A ERP44 ESAM ESRRB ETV2 EXT1 EXT2 F11R F2 FA2H FABP5 FADD FAM20A FAM210B FANCC FATE1 FBN1 FBN2 FBXL5 FBXO4 FBXW7 FFAR1 FFAR2 FGGY FH FIS1 FITM2 FKBP1B FLCN FLG FLG2 FLVCR1 FMO1 FMO4 FOXA3 FOXC1 FOXK1 FOXK2 FOXN1 FRRS1 FSHR FSTL1 FTHL17 FTL FTMT FTO FUNDC2 FXN FZD9 G6PC GAA GAS6 GATA1 GATA2 GATA4 GBA GCGR GCKR GCLC GCLM GCM2 GCNT2 GCNT4 GDF2 GHRHR GIGYF2 GIP GIT1 GJB6 GLIS2 GLRX2 GLRX3 GLRX5 GLS GOT1 GPAM GPI GPIHBP1 GPR1 GPR12 GPR183 GPR21 GPR3 GPR55 GPR89A GPR89B GPRASP2 GRAMD1B GRHL1 GRHL3 GRIA1 GRIK2 GRIK5 GRIN1 GRINA GRM1 GRM2 GRM5 GRN GSTP1 HAAO HACD3 HAS2 HCAR2 HCRT HCRTR1 HCRTR2 HDAC9 HEPH HEPHL1 HERPUD1 HEXB HFE HIPK2 HJV HK1 HK2 HK3 HKDC1 HMOX2 HNF1A HOMER1 HOMER2 HOXA13 HOXB6 HPX HRC HRNR HSCB HSPA9 HTR1B HTR2A HTR2B HTR2C HVCN1 HYAL2 IAPP IDE IFIT1 IGFBP5 IHH IL20RB IL31RA ILDR1 ILDR2 IMMT INAVA INHA INHBA INPP5K INSIG1 INSR IQCB1 IREB2 IRX3 ISCU ITGB6 ITPKB JAK3 JAM2 JAM3 JCHAIN JMJD6 JPH2 KAT5 KCNA1 KCNA5 KCNB1 KCNE3 KCNH2 KCNJ10 KCNJ2 KCNMA1 KCNN4 KCTD17 KCTD7 KDF1 KEL KLF1 KLF15 KLF2 KLF7 KLHL3 KMT2A KMT2E KRAS KRIT1 KRT1 KRT16 LACC1 LACRT LAMA2 LAMC1 LAMP2 LAMTOR1 LARGE1 LARGE2 LAT LCA5 LCK LCN1 LCN2 LDB1 LDB2 LDLR LDLRAP1 LEP LETM1 LETM2 LGR4 LIMA1 LIN28A LIPA LIPC LIPG LPCAT1 LPCAT3 LRP5 LRRC19 LRRC8A LRRC8D LRRC8E LRRK1 LRRK2 LSR LYAR LYZ MAEA MAFG MAIP1 MALL MALRD1 MAP1A MBD5 MC3R MCU MCUB MCUR1 MED13 MELTF MERTK METRNL MEX3C MFHAS1 MFSD2A MICU1 MICU2 MICU3 MKKS MKS1 MLLT6 MPIG6B MPL MPV17 MRAP2 MSTN MT1A MT1B MT1E MT1F MT1G MT1H MT1HL1 MT1M MT1X MT2A MT3 MT4 MTCH2 MTF1 MTHFD1 MTM1 MTNR1B MUC13 MUC17 MUC2 MUC4 MUC6 MYB MYCT1 MYLIP MYO5B NANOS1 NAPEPLD NAPSA NBEA NCAPG2 NCDN NCKAP1L NCOA4 NCSTN NDFIP1 NDN NELL2 NEO1 NEUROD1 NFE2L1 NGFR NKX2-3 NLE1 NLRP6 NMB NMU NOD2 NOTCH1 NOX3 NOX4 NPC1 NPC2 NPHP3 NPHP4 NPTN NPTX1 NR1D1 NR1D2 NR1H2 NR1H4 NR4A3 NR5A2 NTSR1 NUBP1 NUCKS1 NUS1 NXNL1 NXNL2 OAS1 OCIAD1 OCIAD2 OCLN OMA1 OPRPN OR10J5 ORMDL1 ORMDL2 ORMDL3 OTC P2RX1 P2RX4 P2RX7 P2RY1 P2RY2 P2RY4 PACS2 PARK7 PASK PAX2 PAX6 PBLD PCDH15 PDE4B PDK2 PDK3 PDK4 PDX1 PDZD8 PFKM PICALM PIGR PIP PIWIL4 PKD2 PKHD1 PKN1 PKNOX1 PLA2G10 PLA2G12B PLA2G2A PLAA PLEC PLG PLN PLSCR3 PM20D1 PMAIP1 PML PNPLA1 PNPLA3 PNPLA4 PNPLA5 PNPLA8 POC1B POLB POLD1 POTEE POTEI POU3F3 PPP1R13L PPP1R3G PPP2R3C PPP3CA PPP3CB PPT1 PRCP PRDM14 PRDX1 PRDX3 PRDX4 PRDX5 PRDX6 PRKAA2 PRKACA PRKCB PRLH PRND PRNP PRR4 PTBP3 PTCH1 PTH1R PTPN11 PTPN2 PTPRN PTPRN2 PYGL RAB11B RAB11FIP2 RAB11FIP5 RAB38 RAB3D RAB7A RABGAP1 RAC3 RACK1 RALY RAP1GDS1 RASSF2 RB1 RBM4 RBP1 RC3H1 RC3H2 RCOR1 RDH12 RFX6 RGN RHAG RHBG RHCE RHCG RHD RHEX RHO RHOT1 RHOT2 RIPK3 RMDN3 RMI1 RNASEK RNF135 RORA RP1 RP1L1 RPE65 RPH3AL RPS14 RPS17 RPS19 RPS24 RRN3 RRP8 RTN4 RYR1 RYR3 S100A14 S100A8 S100A9 SAR1B SART3 SASH3 SCARA5 SCGN SCN7A SCNN1A SCNN1B SCNN1D SCNN1G SCO1 SCO2 SCT SCTR SCX SEC24A SELENOK SELENON SELENOS SELENOT SEPTIN4 SERPINA3 SERPINF1 SESN2 SESN3 SFN SFRP4 SFTPD SFXN1 SGCD SGCZ SGIP1 SH2B2 SH2B3 SH3GL2 SHANK3 SIDT2 SIN3A SIRT6 SIT1 SIVA1 SKIL SLAMF8 SLC10A7 SLC11A2 SLC12A1 SLC12A2 SLC12A4 SLC12A5 SLC12A6 SLC12A7 SLC12A9 SLC15A4 SLC16A1 SLC17A6 SLC17A7 SLC17A8 SLC1A1 SLC1A3 SLC22A12 SLC22A17 SLC24A1 SLC24A2 SLC24A4 SLC24A5 SLC25A23 SLC25A28 SLC25A37 SLC25A38 SLC25A46 SLC25A5 SLC26A3 SLC26A4 SLC26A6 SLC28A2 SLC29A1 SLC2A10 SLC2A4 SLC30A1 SLC30A10 SLC30A2 SLC30A3 SLC30A4 SLC30A5 SLC30A7 SLC30A8 SLC30A9 SLC31A1 SLC31A2 SLC34A1 SLC34A2 SLC34A3 SLC35D3 SLC35G1 SLC37A4 SLC39A10 SLC39A12 SLC39A13 SLC39A14 SLC39A3 SLC39A4 SLC39A5 SLC39A6 SLC39A7 SLC39A8 SLC41A1 SLC46A1 SLC4A1 SLC4A10 SLC4A11 SLC4A2 SLC4A3 SLC4A4 SLC4A5 SLC4A8 SLC4A9 SLC6A2 SLC7A8 SLC8A1 SLC8A2 SLC8A3 SLC8B1 SLC9A1 SLC9A2 SLC9A4 SLC9A5 SLC9A6 SLC9A7 SLC9A8 SLC9A9 SLC9B1 SLC9C1 SLC9C2 SLITRK1 SMAD1 SMAD5 SMDT1 SMO SNAPIN SNX10 SOAT1 SOAT2 SOD2 SOS2 SOX4 SOX9 SP3 SPATA7 SPNS2 SPRR2A SPRR2B SPTA1 SRF SRI ST6GALNAC1 STAT1 STAU1 STC1 STC2 STEAP1 STEAP2 STEAP4 STIM1 STIM2 STK39 STMN1 STOML2 STRAP STXBP3 STXBP5L SUCNR1 SURF4 SUV39H1 SV2A SYPL2 TAL1 TAOK1 TBC1D20 TBXAS1 TCIRG1 TENT4B TESMIN TFAP2B TFF1 TFF2 TFF3 TFR2 TGFBR3 TGM2 THADA THRA TJP1 TJP2 TJP3 TLCD1 TLCD3A TLCD3B TLCD4 TLR9 TM6SF2 TM9SF4 TMBIM6 TMC8 TMCO1 TMEM106B TMEM14C TMEM165 TMEM175 TMEM178A TMEM199 TMEM64 TMEM79 TMEM97 TMOD3 TMPRSS3 TMPRSS6 TMTC2 TMTC4 TNFAIP3 TNFRSF11A TNFRSF13B TNFRSF17 TNFSF11 TNFSF13B TNFSF14 TNNI3 TNS2 TP53INP2 TP63 TPCN2 TPP1 TPP2 TPT1 TRA2B TRAF3IP2 TRAF6 TRDN TREM2 TRIM10 TRIM24 TRIM32 TRIM6 TRPA1 TRPC3 TRPC4 TRPC5 TRPC6 TRPC7 TRPM2 TRPM7 TRPM8 TRPV1 TSKU TSPO TSPO2 TSPOAP1 TTC39B TTC7A TUB TULP1 TWNK TXN TXN2 TXNDC2 TXNRD1 TXNRD2 TXNRD3 TYRO3 UBA5 UBAP2L UBB UBE2C UBE2K UBE2S UBE3A UFL1 UGCG UMOD UNC13B UNC80 UPK3A USF1 USF2 USH1C USH1G USH2A USP45 VAPB VCL VGF VPS33A VPS54 VSIG1 WDR36 WDR48 WDTC1 WFS1 WHRN WNK1 WNK2 WNK3 WNK4 WNT5A WNT7B WWTR1 XIAP XK XKR8 XPR1 YWHAE ZBTB20 ZBTB7A ZC3H8 ZFPM1 ZFY ZG16B ZNF236 ZNF675 ZNHIT1","10.156","1141","C166771","false","C166771"
"0.0","0.0","0","false","SLC30A1 SLC30A10 SLC30A2 SLC30A3 SLC30A4 SLC30A5 SLC30A7 SLC30A9 SLC39A10 SLC39A12 SLC39A13 SLC39A3 SLC39A4 SLC39A5 SLC39A6 SLC39A7","4.0","16","C166264","false","C166264"
"0.0","0.0","0","false","MT1A MT1B MT1E MT1F MT1G MT1H MT1HL1 MT1M MT1X MT2A MT3 MT4 MTF1 TESMIN","3.807","14","C166265","false","C166265"
"0.0","0.0","0","false","ABCA12 ABCA5 FLG FLG2 GCNT2 HRNR KLF7 KRT1 KRT16 S100A14 SPRR2A SPRR2B TMEM79","3.7","13","C166266","false","C166266"
"0.0","0.0","0","false","BOLA1 BOLA2 BOLA2B BOLA3 CIAO3 GLRX3 GLRX5 GPR89A GPR89B HSCB ISCU NUBP1","3.585","12","C166267","false","C166267"
"0.0","0.0","0","false","AFG3L2 LETM1 MAIP1 MCU MCUB MCUR1 MICU1 MICU2 MICU3 SLC25A23 SLC8B1 SMDT1","3.585","12","C166268","false","C166268"
"0.0","0.0","0","false","BBS1 BBS10 BBS12 BBS2 BBS4 GLIS2 IQCB1 MKKS MKS1 NPHP3 NPHP4 TRIM32","3.585","12","C166269","false","C166269"
"0.0","0.0","0","false","ABCA4 AIPL1 CDHR1 CNGB1 HAAO LCA5 MERTK RDH12 RP1L1 RPE65 SPATA7 TULP1","3.585","12","C166270","false","C166270"
"0.0","0.0","0","false","AZGP1 BPIFA1 CST4 LACRT LCN1 LYZ OPRPN PIGR PIP POTEI PRR4 ZG16B","3.585","12","C166271","false","C166271"
"0.0","0.0","0","false","ADGRV1 CDH23 CIB2 CLRN1 GJB6 ILDR1 PCDH15 TMPRSS3 USH1C USH1G USH2A WHRN","3.585","12","C166272","false","C166272"
"0.0","0.0","0","false","ATOX1 ATP7A ATP7B COX11 COX19 CUTC HEPHL1 SCO1 SCO2 SLC31A1 SLC31A2","3.459","11","C166273","false","C166273"
"0.0","0.0","0","false","DHPS EIF5A2 LETM2 LYAR NLE1 RPS14 RPS17 RPS19 RPS24 TPT1 WDR36","3.459","11","C166274","false","C166274"
"0.0","0.0","0","false","CHP1 HVCN1 SLC4A10 SLC9A2 SLC9A5 SLC9A6 SLC9A7 SLC9A9 SLC9B1 SLC9C1 SLC9C2","3.459","11","C166275","false","C166275"
"0.0","0.0","0","false","KCTD17 KLHL3 SLC12A4 SLC12A5 SLC12A6 SLC12A7 STK39 WNK1 WNK2 WNK3 WNK4","3.459","11","C166276","false","C166276"
"0.0","0.0","0","false","BHLHA15 GCNT4 MUC13 MUC17 MUC2 MUC4 MUC6 RP1 TFF1 TFF2 TFF3","3.459","11","C166277","false","C166277"
"0.0","0.0","0","false","AHSP EPB42 KEL RHAG RHCE RHD SLC4A1 SPTA1 TRIM10 TSPO2 XK","3.459","11","C166278","false","C166278"
"0.0","0.0","0","false","ABHD4 CNR1 GPR183 GPR3 GPR55 HCAR2 MTNR1B NAPEPLD SIDT2 SUCNR1","3.322","10","C166279","false","C166279"
"0.0","0.0","0","false","ACADL ACADVL ACOX2 ACOX3 ACOXL ACSM1 ACSM2A ACSM3 BDH2 CARTPT","3.322","10","C166280","false","C166280"
"0.0","0.0","0","false","ABCB10 ABCB7 ALAS1 ALAS2 FLVCR1 SFXN1 SLC25A28 SLC25A37 SLC25A38 TMEM14C","3.322","10","C166281","false","C166281"
"0.0","0.0","0","false","ALOX12 ALOX12B ALOX5 CYP4A11 CYP4F2 PLA2G10 PLA2G12B PLA2G2A TBXAS1","3.17","9","C166282","false","C166282"
"0.0","0.0","0","false","ASPH CASQ2 DHRS7C FKBP1B JPH2 RYR3 SRI SYPL2 TRDN","3.17","9","C166283","false","C166283"
"0.0","0.0","0","false","ATP13A2 CLCN6 CLN3 CLN5 CLN6 CLN8 KCTD7 PPT1 TPP1","3.17","9","C166284","false","C166284"
"0.0","0.0","0","false","HAS2 HYAL2 NBEA PBLD RHEX STRAP TMTC2 TMTC4","3.0","8","C166285","false","C166285"
"0.0","0.0","0","false","AP3B1 AP3D1 ARF1 DNASE2 PICALM SGIP1 SH3GL2 SNAPIN","3.0","8","C166286","false","C166286"
"0.0","0.0","0","false","BMP6 ERFE HFE HJV NEO1 ST6GALNAC1 TFR2 TMPRSS6","3.0","8","C166287","false","C166287"
"0.0","0.0","0","false","DISP3 EXT1 EXT2 GPRASP2 IHH PTCH1 SMO","2.807","7","C166288","false","C166288"
"0.0","0.0","0","false","C19orf12 ELOVL1 FA2H FTHL17 FTL HACD3 SCARA5","2.807","7","C166289","false","C166289"
"0.0","0.0","0","false","ERCC2 ERCC6 PPP1R3G RRN3 SLC25A5 ZC3H8 ZNF236","2.807","7","C166290","false","C166290"
"0.0","0.0","0","false","ABCA2 ABCB6 ABCB8 ATP1B2 ATP1B3 ATP4B CCDC51","2.807","7","C166291","false","C166291"
"0.0","0.0","0","false","CLDN1 CLDN12 CLDN16 CLDN3 CLDN4 ESAM TJP3","2.807","7","C166292","false","C166292"
"0.0","0.0","0","false","SELENOK SELENON SELENOS SELENOT TXNRD1 TXNRD2 TXNRD3","2.807","7","C166293","false","C166293"
"0.0","0.0","0","false","ABCD1 BCAP31 FIS1 PACS2 PDZD8 RMDN3 VAPB","2.807","7","C166294","false","C166294"
"0.0","0.0","0","false","ACER1 CERT1 ENPP7 GBA STEAP4 TLCD3B UGCG","2.807","7","C166295","false","C166295"
"0.0","0.0","0","false","STIM2 TRPC3 TRPC4 TRPC5 TRPC6 TRPC7 TRPM2","2.807","7","C166296","false","C166296"
"0.0","0.0","0","false","DBH DRD1 DRD2 DRD3 DRD4 DRD5 SLC6A2","2.807","7","C166297","false","C166297"
"0.0","0.0","0","false","FUNDC2 IMMT MPV17 OCIAD1 OMA1 SLC25A46 TWNK","2.807","7","C166298","false","C166298"
"0.0","0.0","0","false","ITGB6 LAMA2 LAMC1 LARGE1 LARGE2 SV2A","2.585","6","C166299","false","C166299"
"0.0","0.0","0","false","RAB3D RPH3AL STXBP3 TSPO TSPOAP1 UNC13B","2.585","6","C166300","false","C166300"
"0.0","0.0","0","false","ATP13A3 GDF2 HOXA13 SKIL SMAD1 SMAD5","2.585","6","C166301","false","C166301"
"0.0","0.0","0","false","CNNM1 CNNM2 CNNM3 CNNM4 SLC41A1 TRPM7","2.585","6","C166302","false","C166302"
"0.0","0.0","0","false","GRAMD1B HEXB LIPA NPC1 NPC2 TMEM97","2.585","6","C166303","false","C166303"
"0.0","0.0","0","false","GPR21 MED13 RABGAP1 RC3H1 RC3H2 TBC1D20","2.585","6","C166304","false","C166304"
"0.0","0.0","0","false","CYP27B1 SLC22A12 SLC34A1 SLC34A2 SLC34A3 STC2","2.585","6","C166305","false","C166305"
"0.0","0.0","0","false","P2RX1 P2RX4 P2RX7 P2RY1 P2RY2 P2RY4","2.585","6","C166306","false","C166306"
"0.0","0.0","0","false","AKAP11 CITED2 FTO IRX3 MTCH2 TFAP2B","2.585","6","C166307","false","C166307"
"0.0","0.0","0","false","C15orf41 KLF1 LDB1 LDB2 TAL1 ZFPM1","2.585","6","C166308","false","C166308"
"0.0","0.0","0","false","GAA HK1 HK2 HK3 HKDC1 PFKM","2.585","6","C166309","false","C166309"
"0.0","0.0","0","false","CORO1A DRAM2 NCKAP1L POC1B SASH3 TMC8","2.585","6","C166310","false","C166310"
"0.0","0.0","0","false","ASXL1 BAP1 FOXK1 FOXK2 MBD5 UBAP2L","2.585","6","C166311","false","C166311"
"0.0","0.0","0","false","AQP1 AQP11 AQP2 AQP3 AQP6 FGGY","2.585","6","C166312","false","C166312"
"0.0","0.0","0","false","COL3A1 FBN1 FBN2 FSTL1 SCX SLC2A10","2.585","6","C166313","false","C166313"
"0.0","0.0","0","false","ANKRD9 CCDC22 COMMD1 COMMD9 DDB1 WDTC1","2.585","6","C166314","false","C166314"
"0.0","0.0","0","false","CCN4 FZD9 LRP5 SFRP4 WNT5A WNT7B","2.585","6","C166315","false","C166315"
"0.0","0.0","0","false","GRM1 GRM5 HOMER1 HOMER2 NCDN SHANK3","2.585","6","C166316","false","C166316"
"0.0","0.0","0","false","ACIN1 PTBP3 RALY RBM4 SART3 TRA2B","2.585","6","C166317","false","C166317"
"0.0","0.0","0","false","ABHD5 ALOXE3 PNPLA1 PNPLA4 PNPLA5 PNPLA8","2.585","6","C166318","false","C166318"
"0.0","0.0","0","false","CLCN3 CLNS1A KCNJ10 LRRC8A LRRC8D LRRC8E","2.585","6","C166319","false","C166319"
"0.0","0.0","0","false","CAV2 CCDC47 FOXC1 MALL TMCO1","2.322","5","C166320","false","C166320"
"0.0","0.0","0","false","ANO6 BSG NELL2 NPTN XKR8","2.322","5","C166321","false","C166321"
"0.0","0.0","0","false","ARMCX1 DISC1 RAP1GDS1 RHOT1 RHOT2","2.322","5","C166322","false","C166322"
"0.0","0.0","0","false","SCN7A SCNN1A SCNN1B SCNN1D SCNN1G","2.322","5","C166323","false","C166323"
"0.0","0.0","0","false","GPR12 IL31RA TRPA1 TRPM8 TRPV1","2.322","5","C166324","false","C166324"
"0.0","0.0","0","false","GRM2 HTR1B HTR2A HTR2B HTR2C","2.322","5","C166325","false","C166325"
"0.0","0.0","0","false","CYB561 CYB561A3 CYB561D2 FRRS1 HPX","2.322","5","C166326","false","C166326"
"0.0","0.0","0","false","CYBRD1 SLC39A14 SLC39A8 STEAP1 STEAP2","2.322","5","C166327","false","C166327"
"0.0","0.0","0","false","RHBG RHCG SLC12A1 SLC4A2 SLC9A4","2.322","5","C166328","false","C166328"
"0.0","0.0","0","false","CDK5RAP3 UBA5 UBE2K UBE2S UFL1","2.322","5","C166329","false","C166329"
"0.0","0.0","0","false","CCNB2 NCAPG2 SIVA1 STMN1 UBE2C","2.322","5","C166330","false","C166330"
"0.0","0.0","0","false","ARID4A KMT2E RCOR1 SIN3A ZNHIT1","2.322","5","C166331","false","C166331"
"0.0","0.0","0","false","BACE2 IDE NCSTN NUS1 RTN4","2.322","5","C166332","false","C166332"
"0.0","0.0","0","false","SLC26A3 SLC26A6 SLC4A4 SLC4A9 SLC9A8","2.322","5","C166333","false","C166333"
"0.0","0.0","0","false","KCNA5 KCNB1 KCNE3 KCNH2 KCNJ2","2.322","5","C166334","false","C166334"
"0.0","0.0","0","false","CAPN3 CAV3 DMD SGCD SGCZ","2.322","5","C166335","false","C166335"
"0.0","0.0","0","false","BARD1 FANCC POLD1 RMI1 WDR48","2.322","5","C166336","false","C166336"
"0.0","0.0","0","false","GCGR GHRHR GIP SCT SCTR","2.322","5","C166337","false","C166337"
"0.0","0.0","0","false","CRY1 CRY2 NR1D1 NR1D2 RORA","2.322","5","C166338","false","C166338"
"0.0","0.0","0","false","ATP2C1 CFL2 SLC10A7 TM9SF4 TMEM165","2.322","5","C166339","false","C166339"
"0.0","0.0","0","false","CALB2 EMX1 SLC17A6 SLC17A7 SLC17A8","2.322","5","C166340","false","C166340"
"0.0","0.0","0","false","ADIPOR1 ADIPOR2 APPL2 GPR1 TLCD1","2.322","5","C166341","false","C166341"
"0.0","0.0","0","false","ACP5 AMPD2 ENPP1 ENPP3 PDE4B","2.322","5","C166342","false","C166342"
"0.0","0.0","0","false","EHD1 MYO5B RAB11B RAB11FIP2 RAB11FIP5","2.322","5","C166343","false","C166343"
"0.0","0.0","0","false","ADAR DDX3X NLRP6 STAU1","2.0","4","C166344","false","C166344"
"0.0","0.0","0","false","CTSH NAPSA NKX2-3 PTPN2","2.0","4","C166345","false","C166345"
"0.0","0.0","0","false","SNX10 TCIRG1 TNFRSF11A TNFSF14","2.0","4","C166346","false","C166346"
"0.0","0.0","0","false","CARD11 CARD9 LACC1 NOD2","2.0","4","C166347","false","C166347"
"0.0","0.0","0","false","ATP6V0A1 NUCKS1 PM20D1 TMEM175","2.0","4","C166348","false","C166348"
"0.0","0.0","0","false","GLRX2 PRDX5 TXN2 TXNDC2","2.0","4","C166349","false","C166349"
"0.0","0.0","0","false","ADA ADORA1 SLC28A2 SLC29A1","2.0","4","C166350","false","C166350"
"0.0","0.0","0","false","E2F4 RB1 RRP8 SUV39H1","2.0","4","C166351","false","C166351"
"0.0","0.0","0","false","LRRC19 PLAA UBB USP45","2.0","4","C166352","false","C166352"
"0.0","0.0","0","false","PTPRN PTPRN2 SLC30A8 SLC35D3","2.0","4","C166353","false","C166353"
"0.0","0.0","0","false","CCDC186 LAMP2 VPS33A VPS54","2.0","4","C166354","false","C166354"
"0.0","0.0","0","false","ERO1A ERP44 JCHAIN PRDX4","2.0","4","C166355","false","C166355"
"0.0","0.0","0","false","CSMD1 GRIK2 GRIK5 SLC1A1","2.0","4","C166356","false","C166356"
"0.0","0.0","0","false","DOCK10 DOCK11 GIT1 RAC3","2.0","4","C166357","false","C166357"
"0.0","0.0","0","false","GCLC GCLM MAFG NFE2L1","2.0","4","C166358","false","C166358"
"0.0","0.0","0","false","CNBP DMPK PLN TENT4B","2.0","4","C166359","false","C166359"
"0.0","0.0","0","false","CXADR F11R JAM2 JAM3","2.0","4","C166360","false","C166360"
"0.0","0.0","0","false","CHERP CIB3 PLSCR3 RACK1","2.0","4","C166361","false","C166361"
"0.0","0.0","0","false","FSHR INHA INHBA TGFBR3","2.0","4","C166362","false","C166362"
"0.0","0.0","0","false","CAMLG TNFRSF13B TNFRSF17 TNFSF13B","2.0","4","C166363","false","C166363"
"0.0","0.0","0","false","ATP1A2 CROCC SCGN STXBP5L","2.0","4","C166364","false","C166364"
"0.0","0.0","0","false","CCKBR NMB NMU NTSR1","2.0","4","C166365","false","C166365"
"0.0","0.0","0","false","BAK1 BBC3 BOK PMAIP1","2.0","4","C166366","false","C166366"
"0.0","0.0","0","false","DLD PDK2 PDK3 PDK4","2.0","4","C166367","false","C166367"
"0.0","0.0","0","false","ATP6V1F ATP6V1G1 DMXL1 DMXL2","2.0","4","C166368","false","C166368"
"0.0","0.0","0","false","ATP2B1 SLC8A1 SLC8A2 SLC8A3","2.0","4","C166369","false","C166369"
"0.0","0.0","0","false","BAD PPP3CA PPP3CB UNC80","2.0","4","C166370","false","C166370"
"0.0","0.0","0","false","AKR1C1 ATP2B3 CYP11B1 CYP11B2","2.0","4","C166371","false","C166371"
"0.0","0.0","0","false","APEX1 POLB SIRT6 TPP2","2.0","4","C166372","false","C166372"
"0.0","0.0","0","false","DCTN1 DYNLT1 INAVA SLC4A5","2.0","4","C166373","false","C166373"
"0.0","0.0","0","false","BECN2 BNIP3 MAP1A TP53INP2","2.0","4","C166374","false","C166374"
"0.0","0.0","0","false","INPP5K ITPKB MFHAS1 TREM2","2.0","4","C166375","false","C166375"
"0.0","0.0","0","false","EDN2 EDN3 EDNRA EDNRB","2.0","4","C166376","false","C166376"
"0.0","0.0","0","false","CCL1 CCL13 CCL15 CCR4","2.0","4","C166377","false","C166377"
"0.0","0.0","0","false","ADM CALCA CALCB IAPP","2.0","4","C166378","false","C166378"
"0.0","0.0","0","false","ANGPTL3 ANGPTL4 ANGPTL8 GPIHBP1","2.0","4","C166379","false","C166379"
"0.0","0.0","0","false","ADGRF5 CDH5 EMCN MYCT1","2.0","4","C166380","false","C166380"
"0.0","0.0","0","false","COL11A2 COL2A1 COMP PTH1R","2.0","4","C166381","false","C166381"
"0.0","0.0","0","false","APOC4 APOM LSR SPNS2","2.0","4","C166382","false","C166382"
"0.0","0.0","0","false","CHMP2B CHMP4B GRN TMEM106B","2.0","4","C166383","false","C166383"
"0.0","0.0","0","false","PASK SLC12A2 SLC12A9","1.585","3","C166384","false","C166384"
"0.0","0.0","0","false","ORMDL1 ORMDL2 ORMDL3","1.585","3","C166385","false","C166385"
"0.0","0.0","0","false","NANOS1 PIWIL4 SOX4","1.585","3","C166386","false","C166386"
"0.0","0.0","0","false","SEPTIN4 TTC7A XIAP","1.585","3","C166387","false","C166387"
"0.0","0.0","0","false","BMP8A NDN UBE3A","1.585","3","C166388","false","C166388"
"0.0","0.0","0","false","KDF1 SFN WWTR1","1.585","3","C166389","false","C166389"
"0.0","0.0","0","false","EPHX2 FMO1 FMO4","1.585","3","C166390","false","C166390"
"0.0","0.0","0","false","ENSP00000498010 KLF2 KRIT1","1.585","3","C166391","false","C166391"
"0.0","0.0","0","false","S100A8 S100A9 TAOK1","1.585","3","C166392","false","C166392"
"0.0","0.0","0","false","SLC24A4 SLC24A5 TPCN2","1.585","3","C166393","false","C166393"
"0.0","0.0","0","false","DYRK3 GATA1 TLCD4","1.585","3","C166394","false","C166394"
"0.0","0.0","0","false","DGAT1 FITM2 MAEA","1.585","3","C166395","false","C166395"
"0.0","0.0","0","false","CYP39A1 MALRD1 NR1H4","1.585","3","C166396","false","C166396"
"0.0","0.0","0","false","CYB5R4 MC3R MRAP2","1.585","3","C166397","false","C166397"
"0.0","0.0","0","false","CXorf21 SLC15A4 TLR9","1.585","3","C166398","false","C166398"
"0.0","0.0","0","false","CRB1 CRB2 TJP1","1.585","3","C166399","false","C166399"
"0.0","0.0","0","false","ALDH1A1 CYP26B1 RBP1","1.585","3","C166400","false","C166400"
"0.0","0.0","0","false","KCNA1 KCNMA1 KCNN4","1.585","3","C166401","false","C166401"
"0.0","0.0","0","false","ATP2A1 ATP2A3 HRC","1.585","3","C166402","false","C166402"
"0.0","0.0","0","false","LIMA1 PLEC VCL","1.585","3","C166403","false","C166403"
"0.0","0.0","0","false","LAT LCK SIT1","1.585","3","C166404","false","C166404"
"0.0","0.0","0","false","ESRRB LIN28A PRDM14","1.585","3","C166405","false","C166405"
"0.0","0.0","0","false","CCL23 CCL7 CXCL6","1.585","3","C166406","false","C166406"
"0.0","0.0","0","false","GRIA1 NPTX1 SLITRK1","1.585","3","C166407","false","C166407"
"0.0","0.0","0","false","CAV1 FATE1 VSIG1","1.585","3","C166408","false","C166408"
"0.0","0.0","0","false","CASR FOXN1 GCM2","1.585","3","C166409","false","C166409"
"0.0","0.0","0","false","DEDD2 ENDOG FADD","1.585","3","C166410","false","C166410"
"0.0","0.0","0","false","CRTC1 CRTC2 CRTC3","1.585","3","C166411","false","C166411"
"0.0","0.0","0","false","ADNP PAX6 PKNOX1","1.585","3","C166412","false","C166412"
"0.0","0.0","0","false","GRHL1 GRHL3 PRKCB","1.585","3","C166413","false","C166413"
"0.0","0.0","0","false","BCR KMT2A MLLT6","1.585","3","C166414","false","C166414"
"0.0","0.0","0","false","DNAJA3 DNAJB2 HSPA9","1.585","3","C166415","false","C166415"
"0.0","0.0","0","false","SAR1B SEC24A SURF4","1.585","3","C166416","false","C166416"
"0.0","0.0","0","false","CCL8 IFIT1 OAS1","1.585","3","C166417","false","C166417"
"0.0","0.0","0","false","BAX GRINA TMBIM6","1.585","3","C166418","false","C166418"
"0.0","0.0","0","false","CHRNA1 CHRNA7 GRIN1","1.585","3","C166419","false","C166419"
"0.0","0.0","0","false","ATP1B1 MEX3C RNF135","1.585","3","C166420","false","C166420"
"0.0","0.0","0","false","SLC4A11 SLC9A1 TMEM178A","1.585","3","C166421","false","C166421"
"0.0","0.0","0","false","CPS1 GLS OTC","1.585","3","C166422","false","C166422"
"0.0","0.0","0","false","CA12 EGLN1 EGLN2","1.585","3","C166423","false","C166423"
"0.0","0.0","0","false","ADCY6 ADCY8 ADRA2A","1.585","3","C166424","false","C166424"
"0.0","0.0","0","false","ANK3 ARHGEF5 LRRK1","1.585","3","C166425","false","C166425"
"0.0","0.0","0","false","PAX2 UMOD UPK3A","1.585","3","C166426","false","C166426"
"0.0","0.0","0","false","DMTN FAM210B TMOD3","1.585","3","C166427","false","C166427"
"0.0","0.0","0","false","GCKR PNPLA3 TM6SF2","1.585","3","C166428","false","C166428"
"0.0","0.0","0","false","HDAC9 USF1 USF2","1.585","3","C166429","false","C166429"
"0.0","0.0","0","false","LCN2 SLC22A17 SLC7A8","1.585","3","C166430","false","C166430"
"0.0","0.0","0","false","NEUROD1 PDX1 RFX6","1.585","3","C166431","false","C166431"
"0.0","0.0","0","false","GAS6 TUB TYRO3","1.585","3","C166432","false","C166432"
"0.0","0.0","0","false","PRDX1 SESN2 SESN3","1.585","3","C166433","false","C166433"
"0.0","0.0","0","false","ALDOA BPGM GPI","1.585","3","C166434","false","C166434"
"0.0","0.0","0","false","AVP AVPR1A AVPR1B","1.585","3","C166435","false","C166435"
"0.0","0.0","0","false","FFAR1 FFAR2 STC1","1.585","3","C166436","false","C166436"
"0.0","0.0","0","false","HCRT HCRTR1 HCRTR2","1.585","3","C166437","false","C166437"
"0.0","0.0","0","false","CPB2 F2 SERPINF1","1.585","3","C166438","false","C166438"
"0.0","0.0","0","false","CYBA NOX3 NOX4","1.585","3","C166439","false","C166439"
"0.0","0.0","0","false","HIPK2 MYB PML","1.585","3","C166440","false","C166440"
"0.0","0.0","0","false","CLIC4 CMA1 ELANE","1.585","3","C166441","false","C166441"
"0.0","0.0","0","false","RHO SLC24A1 SLC24A2","1.585","3","C166442","false","C166442"
"0.0","0.0","0","false","BTBD9 FBXL5 IREB2","1.585","3","C166443","false","C166443"
"0.0","0.0","0","false","ATP13A1 LRRK2 RAB38","1.585","3","C166444","false","C166444"
"0.0","0.0","0","false","DGAT2 LPCAT1 LPCAT3","1.585","3","C166445","false","C166445"
"0.0","0.0","0","false","CES1 SOAT1 SOAT2","1.585","3","C166446","false","C166446"
"0.0","0.0","0","false","ABCC6 ALPL ANKH","1.585","3","C166447","false","C166447"
"0.0","0.0","0","false","ABCB11 CYP7B1 NR5A2","1.585","3","C166448","false","C166448"
"0.0","0.0","0","false","ABCA3 AGER SFTPD","1.585","3","C166449","false","C166449"
"0.0","0.0","0","false","CA7 CALB1 ZBTB20","1.585","3","C166450","false","C166450"
"0.0","0.0","0","false","ANXA1 ANXA6 JMJD6","1.585","3","C166451","false","C166451"
"0.0","0.0","0","false","ACACB PRKAA2","1.0","2","C166452","false","C166452"
"0.0","0.0","0","false","NR4A3 THRA","1.0","2","C166453","false","C166453"
"0.0","0.0","0","false","NXNL2 TXN","1.0","2","C166454","false","C166454"
"0.0","0.0","0","false","PKN1 YWHAE","1.0","2","C166455","false","C166455"
"0.0","0.0","0","false","OR10J5 PRKACA","1.0","2","C166456","false","C166456"
